<?xml version="1.0" encoding="UTF-8"?>
<xs:schema xmlns:xs="http://www.w3.org/2001/XMLSchema" elementFormDefault="qualified">
    <xs:element name="QuanLySinhVien">
        <xs:complexType>
            <xs:sequence>

                <xs:element name="SinhVien" maxOccurs="unbounded">
                    <xs:complexType>
                        <xs:sequence>
                            <xs:element name="MaSv" type="xs:string"/>
                            <xs:element name="TenSv" type="xs:string"/>
                            <xs:element name="GioiTinh">
                                <xs:simpleType>
                                    <xs:restriction base="xs:string">
                                        <xs:enumeration value="Nam"/>
                                        <xs:enumeration value="Ná»¯"/>
                                    </xs:restriction>
                                </xs:simpleType>
                            </xs:element>
                            <xs:element name="NgaySinh" type="xs:date"/>
                            <xs:element name="MaLop">
                                <xs:simpleType>
                                    <xs:restriction base="xs:string">
                                        <xs:pattern value="[A-Z][A-Z][A-Z][A-Z][0-9][0-9]"/>
                                    </xs:restriction>
                                </xs:simpleType>
                            </xs:element>
                        </xs:sequence>
                    </xs:complexType>
                </xs:element>
            </xs:sequence>
        </xs:complexType>
    </xs:element>
</xs:schema>
